{"$id":"urn:aevum:schema:aevo.envelope.v1","$schema":"https://json-schema.org/draft/2020-12/schema","additionalProperties":false,"properties":{"canon":{"$ref":"urn:aevum:schema:aevum.common.v1#/$defs/canon"},"kind":{"const":"aevo.envelope.v1"},"sig":{"additionalProperties":false,"properties":{"alg":{"$ref":"urn:aevum:schema:aevum.common.v1#/$defs/sig_alg"},"kid":{"$ref":"urn:aevum:schema:aevum.common.v1#/$defs/kid_ed25519"},"sig_b64":{"$ref":"urn:aevum:schema:aevum.common.v1#/$defs/base64"}},"required":["alg","kid","sig_b64"],"type":"object"},"signed":{"additionalProperties":false,"allOf":[{"oneOf":[{"not":{"required":["payload_ref"]},"required":["payload"]},{"not":{"required":["payload"]},"required":["payload_ref"]}]}],"properties":{"chain_id":{"$ref":"urn:aevum:schema:aevum.common.v1#/$defs/chain_id"},"payload":{"additionalProperties":true,"type":"object"},"payload_hash":{"$ref":"urn:aevum:schema:aevum.common.v1#/$defs/sha256"},"payload_kind":{"pattern":"^[a-z][a-z0-9]*(\\.[a-z0-9]+)*\\.v[0-9]+$","type":"string"},"payload_ref":{"additionalProperties":false,"properties":{"locator":{"maxLength":512,"type":"string"},"store":{"enum":["localfs","objectstore"],"type":"string"}},"required":["store","locator"],"type":"object"},"prev_envelope_hash":{"$ref":"urn:aevum:schema:aevum.common.v1#/$defs/sha256"},"seq":{"minimum":0,"type":"integer"},"stream":{"$ref":"urn:aevum:schema:aevum.common.v1#/$defs/stream_id"},"ts_ns":{"$ref":"urn:aevum:schema:aevum.common.v1#/$defs/u64_ns"}},"required":["stream","chain_id","ts_ns","payload_kind","payload_hash"],"type":"object"},"v":{"const":1}},"required":["kind","v","canon","signed","sig"],"title":"Aevum Envelope v1 (Signed Wrapper)","type":"object"}
