{"canon":"json.jcs.v1","kind":"aevo.envelope.v1","sig":{"alg":"ed25519","kid":"k25519v1:d07e92893be82a041cc5470fa0ae5756b67e8a200e5aaa0bc5406afcb66c06f1","sig_b64":"gBICu7SCJI5z40YSHvn8YLZifyu8OAss6Lnxrk5PtsEdvlN5WEyXTvaldPNDKi28D6DFdwF7z037t9iwEckiDQ=="},"signed":{"chain_id":"chain:timechain.main","payload":{"action":"export","actor":{"actor_type":"local_user","uid":1000,"username":"torasu"},"inputs":{"chain_id":"chain:timechain.main","ledger_root":"/var/lib/aevum/ledger","out_path":"sha256:deadbeef","range":{"end_height_inclusive":0,"start_height":0},"stream":"computer"},"invocation":{"argv":["aevum","export","--stream","computer"],"cmd":"aevum","version":{"name":"aevum","semver":"v0.0.0"}},"kind":"ws.operator_action.v1","outputs":{"export_bundle_hash":"sha256:1111111111111111111111111111111111111111111111111111111111111111","head_after":{"block_hash":"sha256:2222222222222222222222222222222222222222222222222222222222222222","height":0},"head_before":{"block_hash":"sha256:0000000000000000000000000000000000000000000000000000000000000000","height":-1}},"result":{"exit_code":0,"ok":true},"v":1},"payload_hash":"sha256:012d3a00db327e40c3bf15a6334afbcc44354a524d1e0f93082958441fe80c1e","payload_kind":"ws.operator_action.v1","stream":"computer","ts_ns":1700000000000000000},"v":1}
